{
  "match_id": "syn-9001",
  "seed": 9001,
  "competition": "Synthetic League",
  "season": "2026-27",
  "matchday": 3,
  "kickoff_utc": "2026-12-19T14:00:00Z",
  "venue": {
    "name": "Northbridge Park",
    "city": "Northbridge",
    "capacity": 38500
  },
  "conditions": {
    "weather": "overcast",
    "temperature_c": 23,
    "wind_kmh": 26
  },
  "referee": {
    "id": "REF-01",
    "name": "Tobias Wrenfield",
    "strictness": 0.56
  },
  "home_team_id": "NBA",
  "away_team_id": "KVL",
  "teams": [
    {
      "id": "NBA",
      "name": "Northbridge Athletic",
      "short_name": "Northbridge",
      "primary_color": "#1F4E9C",
      "secondary_color": "#F2C230",
      "formation": "4-3-3",
      "coach": "Rafe Osterman",
      "style": {
        "possession": 0.34,
        "pressing": 0.58,
        "tempo": 0.51,
        "directness": 0.69
      },
      "players": [
        {
          "id": "NBA-01",
          "full_name": "Rafferty Juniper",
          "surname": "Juniper",
          "shirt_number": 1,
          "position": "GK",
          "preferred_foot": "right",
          "age": 18,
          "attributes": {
            "pace": 66,
            "passing": 68,
            "shooting": 61,
            "defending": 77,
            "discipline": 75
          },
          "top_speed_kmh": 31.6,
          "season": {
            "appearances": 6,
            "goals": 0,
            "assists": 0,
            "yellow_cards": 0
          }
        },
        {
          "id": "NBA-02",
          "full_name": "Hollis Pellowe",
          "surname": "Pellowe",
          "shirt_number": 39,
          "position": "RB",
          "preferred_foot": "right",
          "age": 26,
          "attributes": {
            "pace": 72,
            "passing": 71,
            "shooting": 53,
            "defending": 76,
            "discipline": 85
          },
          "top_speed_kmh": 32.3,
          "season": {
            "appearances": 9,
            "goals": 0,
            "assists": 0,
            "yellow_cards": 3
          }
        },
        {
          "id": "NBA-03",
          "full_name": "Sota Jessamy",
          "surname": "Jessamy",
          "shirt_number": 15,
          "position": "CB",
          "preferred_foot": "left",
          "age": 26,
          "attributes": {
            "pace": 66,
            "passing": 58,
            "shooting": 55,
            "defending": 61,
            "discipline": 72
          },
          "top_speed_kmh": 31.6,
          "season": {
            "appearances": 7,
            "goals": 0,
            "assists": 0,
            "yellow_cards": 1
          }
        },
        {
          "id": "NBA-04",
          "full_name": "Sacha Dovecote",
          "surname": "Dovecote",
          "shirt_number": 34,
          "position": "CB",
          "preferred_foot": "left",
          "age": 29,
          "attributes": {
            "pace": 68,
            "passing": 61,
            "shooting": 61,
            "defending": 86,
            "discipline": 65
          },
          "top_speed_kmh": 31.9,
          "season": {
            "appearances": 11,
            "goals": 0,
            "assists": 0,
            "yellow_cards": 0
          }
        },
        {
          "id": "NBA-05",
          "full_name": "Ren Mbatha",
          "surname": "Mbatha",
          "shirt_number": 11,
          "position": "LB",
          "preferred_foot": "right",
          "age": 18,
          "attributes": {
            "pace": 82,
            "passing": 75,
            "shooting": 57,
            "defending": 84,
            "discipline": 81
          },
          "top_speed_kmh": 33.5,
          "season": {
            "appearances": 4,
            "goals": 0,
            "assists": 0,
            "yellow_cards": 0
          }
        },
        {
          "id": "NBA-06",
          "full_name": "Davin Lindqvist",
          "surname": "Lindqvist",
          "shirt_number": 19,
          "position": "DM",
          "preferred_foot": "right",
          "age": 27,
          "attributes": {
            "pace": 56,
            "passing": 73,
            "shooting": 49,
            "defending": 76,
            "discipline": 76
          },
          "top_speed_kmh": 30.4,
          "season": {
            "appearances": 6,
            "goals": 0,
            "assists": 1,
            "yellow_cards": 0
          }
        },
        {
          "id": "NBA-07",
          "full_name": "Rune Ingleby",
          "surname": "Ingleby",
          "shirt_number": 33,
          "position": "CM",
          "preferred_foot": "right",
          "age": 20,
          "attributes": {
            "pace": 65,
            "passing": 70,
            "shooting": 57,
            "defending": 55,
            "discipline": 63
          },
          "top_speed_kmh": 31.5,
          "season": {
            "appearances": 4,
            "goals": 0,
            "assists": 0,
            "yellow_cards": 0
          }
        },
        {
          "id": "NBA-08",
          "full_name": "Tavi Dunmere",
          "surname": "Dunmere",
          "shirt_number": 2,
          "position": "CM",
          "preferred_foot": "right",
          "age": 32,
          "attributes": {
            "pace": 69,
            "passing": 77,
            "shooting": 49,
            "defending": 52,
            "discipline": 77
          },
          "top_speed_kmh": 32.0,
          "season": {
            "appearances": 10,
            "goals": 1,
            "assists": 1,
            "yellow_cards": 0
          }
        },
        {
          "id": "NBA-09",
          "full_name": "Ekon Okonedo",
          "surname": "Okonedo",
          "shirt_number": 21,
          "position": "RW",
          "preferred_foot": "right",
          "age": 26,
          "attributes": {
            "pace": 75,
            "passing": 62,
            "shooting": 72,
            "defending": 62,
            "discipline": 67
          },
          "top_speed_kmh": 32.7,
          "season": {
            "appearances": 4,
            "goals": 1,
            "assists": 0,
            "yellow_cards": 0
          }
        },
        {
          "id": "NBA-10",
          "full_name": "Deji Ashcombe",
          "surname": "Ashcombe",
          "shirt_number": 12,
          "position": "ST",
          "preferred_foot": "right",
          "age": 33,
          "attributes": {
            "pace": 72,
            "passing": 68,
            "shooting": 72,
            "defending": 48,
            "discipline": 74
          },
          "top_speed_kmh": 32.3,
          "season": {
            "appearances": 7,
            "goals": 4,
            "assists": 3,
            "yellow_cards": 1
          }
        },
        {
          "id": "NBA-11",
          "full_name": "Nevin Upfield",
          "surname": "Upfield",
          "shirt_number": 28,
          "position": "LW",
          "preferred_foot": "right",
          "age": 18,
          "attributes": {
            "pace": 80,
            "passing": 61,
            "shooting": 76,
            "defending": 46,
            "discipline": 72
          },
          "top_speed_kmh": 33.2,
          "season": {
            "appearances": 10,
            "goals": 3,
            "assists": 2,
            "yellow_cards": 1
          }
        },
        {
          "id": "NBA-12",
          "full_name": "Femi Eastwell",
          "surname": "Eastwell",
          "shirt_number": 3,
          "position": "GK",
          "preferred_foot": "right",
          "age": 34,
          "attributes": {
            "pace": 71,
            "passing": 68,
            "shooting": 53,
            "defending": 82,
            "discipline": 58
          },
          "top_speed_kmh": 32.2,
          "season": {
            "appearances": 12,
            "goals": 0,
            "assists": 0,
            "yellow_cards": 1
          }
        },
        {
          "id": "NBA-13",
          "full_name": "Valen Garrowby",
          "surname": "Garrowby",
          "shirt_number": 16,
          "position": "CB",
          "preferred_foot": "right",
          "age": 29,
          "attributes": {
            "pace": 63,
            "passing": 72,
            "shooting": 60,
            "defending": 74,
            "discipline": 65
          },
          "top_speed_kmh": 31.3,
          "season": {
            "appearances": 7,
            "goals": 1,
            "assists": 0,
            "yellow_cards": 4
          }
        },
        {
          "id": "NBA-14",
          "full_name": "Fabian Moravec",
          "surname": "Moravec",
          "shirt_number": 13,
          "position": "RB",
          "preferred_foot": "right",
          "age": 22,
          "attributes": {
            "pace": 87,
            "passing": 58,
            "shooting": 62,
            "defending": 70,
            "discipline": 70
          },
          "top_speed_kmh": 34.1,
          "season": {
            "appearances": 9,
            "goals": 0,
            "assists": 0,
            "yellow_cards": 1
          }
        },
        {
          "id": "NBA-15",
          "full_name": "Hale Thursfield",
          "surname": "Thursfield",
          "shirt_number": 29,
          "position": "CM",
          "preferred_foot": "right",
          "age": 31,
          "attributes": {
            "pace": 67,
            "passing": 92,
            "shooting": 60,
            "defending": 52,
            "discipline": 65
          },
          "top_speed_kmh": 31.7,
          "season": {
            "appearances": 12,
            "goals": 0,
            "assists": 0,
            "yellow_cards": 1
          }
        },
        {
          "id": "NBA-16",
          "full_name": "Matteus Haugland",
          "surname": "Haugland",
          "shirt_number": 8,
          "position": "DM",
          "preferred_foot": "right",
          "age": 28,
          "attributes": {
            "pace": 63,